{
  "mcip_version": "1.0.0",
  "bundle_id": "bundle:3cf931b9-4498-4753-ad18-d8ab0567d608",
  "created_at": "2026-07-22T00:00:00Z",
  "producer": "llm-driven-proof-search",
  "records": [
    {
      "schema_version": "1.0.0",
      "record_type": "packet_identity",
      "record_id": "pi.3cf931b9-4498-4753-ad18-d8ab0567d608",
      "packet_id": "frontier.union_closed_pair_element.v1",
      "environment_hash": "9e26d28efe88484c36562da27aa22a2cc73a0638d11532cbbc9071a60609025d",
      "created_at": "2026-07-22T00:00:00Z",
      "trust_status": "kernel_verified",
      "export_eligibility": "public",
      "packet_version": "1.0.0",
      "formal_statement_sha256": "180b0f8328843f40bea350e17414b2f77d516cc342caa79460fd7f42944ab613",
      "status": "kernel_verified",
      "toolchain": {
        "lean_version": "v4.32.0-rc1",
        "mathlib_rev": "360da6fa66c1273b76b6b2d8c5666fd5ac2e3b56"
      },
      "record_hash": "bb962e8a5e800a89465170509cfd45f01d8618d5c34515b892132d03b3eca1ab"
    },
    {
      "schema_version": "1.0.0",
      "record_type": "proof_variant",
      "record_id": "pv.3cf931b9-4498-4753-ad18-d8ab0567d608.canonical",
      "packet_id": "frontier.union_closed_pair_element.v1",
      "environment_hash": "9e26d28efe88484c36562da27aa22a2cc73a0638d11532cbbc9071a60609025d",
      "created_at": "2026-07-22T00:00:00Z",
      "trust_status": "kernel_verified",
      "export_eligibility": "public",
      "formal_statement_sha256": "180b0f8328843f40bea350e17414b2f77d516cc342caa79460fd7f42944ab613",
      "variant_style": "canonical",
      "proof_body_sha256": "28d3653b6d9616a78a7a5ea68cbb4425e07301d823caebbadaa596810a56a0e7",
      "proof_body_redacted": false,
      "tactic_count": 1,
      "proof_length": 1,
      "restriction_profile_id": null,
      "restriction_profile_hash": null,
      "proof_profile_id": "pp.3cf931b9-4498-4753-ad18-d8ab0567d608.canonical",
      "model_run_id": null,
      "source": "proof_search",
      "record_hash": "2d65db5b16655360cde57475e176aa97f5dcc4a07c45b281d8a216d63c857496"
    },
    {
      "schema_version": "1.0.0",
      "record_type": "proof_profile",
      "record_id": "pp.3cf931b9-4498-4753-ad18-d8ab0567d608.canonical",
      "packet_id": "frontier.union_closed_pair_element.v1",
      "environment_hash": "9e26d28efe88484c36562da27aa22a2cc73a0638d11532cbbc9071a60609025d",
      "created_at": "2026-07-22T00:00:00Z",
      "trust_status": "kernel_verified",
      "export_eligibility": "public",
      "proof_variant_id": "pv.3cf931b9-4498-4753-ad18-d8ab0567d608.canonical",
      "primary_proof_class": "theorem_lookup",
      "secondary_proof_classes": [],
      "automation_level": "none",
      "retrieval_depth": 0,
      "branch_count": 0,
      "dependency_composition_depth": 0,
      "uses_witness_invention": false,
      "uses_induction": false,
      "uses_contradiction": false,
      "uses_case_analysis": false,
      "record_hash": "26d1a44760612db6b3db45495e14d52d2801b17c9c62e467797adee80aeac960"
    },
    {
      "schema_version": "1.0.0",
      "record_type": "dependency_manifest",
      "record_id": "dm.3cf931b9-4498-4753-ad18-d8ab0567d608",
      "packet_id": "frontier.union_closed_pair_element.v1",
      "environment_hash": "9e26d28efe88484c36562da27aa22a2cc73a0638d11532cbbc9071a60609025d",
      "created_at": "2026-07-22T00:00:00Z",
      "trust_status": "kernel_verified",
      "export_eligibility": "public",
      "proof_variant_id": "pv.3cf931b9-4498-4753-ad18-d8ab0567d608.canonical",
      "used_theorem_deps": [
        "Finset.mem_union_left"
      ],
      "obligation_deps": [],
      "transitive_dependency_count": 1,
      "transitive_dependency_depth": 1,
      "kits": [],
      "tactic_tags": [
        "Finset.mem_union_left"
      ],
      "prerequisite_concepts": [],
      "record_hash": "932dc4964ad00c0f45cc392686ce1f45c3816c28dff0eb72871396a52f5b940c"
    },
    {
      "schema_version": "1.0.0",
      "record_type": "attempt_record",
      "record_id": "att.3cf931b9-4498-4753-ad18-d8ab0567d608.0",
      "packet_id": "frontier.union_closed_pair_element.v1",
      "environment_hash": "9e26d28efe88484c36562da27aa22a2cc73a0638d11532cbbc9071a60609025d",
      "created_at": "2026-07-22T00:00:00Z",
      "trust_status": "kernel_verified",
      "export_eligibility": "public",
      "episode_id": "a478fec4-f715-4432-a593-cbdd95dde1f4",
      "outcome": "succeeded",
      "diagnostic_category": "unknown_identifier",
      "record_hash": "2a2528f24a3d3662344f7ae9f23e65809ea40d32296b4e691b1b0dc88b0a51d0"
    },
    {
      "schema_version": "1.0.0",
      "record_type": "attempt_record",
      "record_id": "att.3cf931b9-4498-4753-ad18-d8ab0567d608.1",
      "packet_id": "frontier.union_closed_pair_element.v1",
      "environment_hash": "9e26d28efe88484c36562da27aa22a2cc73a0638d11532cbbc9071a60609025d",
      "created_at": "2026-07-22T00:00:00Z",
      "trust_status": "kernel_verified",
      "export_eligibility": "public",
      "episode_id": null,
      "outcome": "failed",
      "diagnostic_category": "unsolved_goals",
      "record_hash": "418830fa6609fdcf364de73e34a3397368f17e125a22fa4217467efd7555f345"
    },
    {
      "schema_version": "1.0.0",
      "record_type": "negative_example",
      "record_id": "neg.3cf931b9-4498-4753-ad18-d8ab0567d608.0",
      "packet_id": "frontier.union_closed_pair_element.v1",
      "environment_hash": "9e26d28efe88484c36562da27aa22a2cc73a0638d11532cbbc9071a60609025d",
      "created_at": "2026-07-22T00:00:00Z",
      "trust_status": "kernel_verified",
      "export_eligibility": "public",
      "attempt_id": "att.3cf931b9-4498-4753-ad18-d8ab0567d608.0",
      "diagnostic_category": "unknown_identifier",
      "origin": "controlled_mutation",
      "proof_authority": "none",
      "can_export_proof_text": false,
      "can_export_metadata": true,
      "can_export_diagnostics": true,
      "can_export_model_identity": false,
      "candidate_source_ref": null,
      "record_hash": "da451c229b381aa98ebe31593e0dc80004746110267852ff6cecd4f2bb5c470d"
    },
    {
      "schema_version": "1.0.0",
      "record_type": "negative_example",
      "record_id": "neg.3cf931b9-4498-4753-ad18-d8ab0567d608.1",
      "packet_id": "frontier.union_closed_pair_element.v1",
      "environment_hash": "9e26d28efe88484c36562da27aa22a2cc73a0638d11532cbbc9071a60609025d",
      "created_at": "2026-07-22T00:00:00Z",
      "trust_status": "kernel_verified",
      "export_eligibility": "public",
      "attempt_id": "att.3cf931b9-4498-4753-ad18-d8ab0567d608.1",
      "diagnostic_category": "unsolved_goals",
      "origin": "controlled_mutation",
      "proof_authority": "none",
      "can_export_proof_text": false,
      "can_export_metadata": true,
      "can_export_diagnostics": true,
      "can_export_model_identity": false,
      "candidate_source_ref": null,
      "record_hash": "c7cb9b50c06868717a0144fc813a9f510194314038ce0ea3f6d50a0e700d8ca5"
    }
  ]
}
