{
  "bundle_id": "bundle:bab11254-b6ff-4979-a73f-b5ac1b0b3268",
  "created_at": "2026-07-21T23:14:52Z",
  "mcip_version": "1.0.0",
  "producer": "llm-driven-proof-search",
  "records": [
    {
      "created_at": "2026-07-21T23:14:52Z",
      "environment_hash": "9e26d28efe88484c36562da27aa22a2cc73a0638d11532cbbc9071a60609025d",
      "export_eligibility": "restricted",
      "formal_statement_sha256": "8dbabc5eb585cb5e57d7bbe13871dc9952fea30b54c4711586d076fe4354ea1e",
      "packet_id": "topology.continuous_id.v1",
      "packet_version": "1.0.0",
      "record_hash": "65843416b71dbaf22103dd8e97a8a8271fbe082a7cb0bb4dd4dd91628bed5c6e",
      "record_id": "bab11254-b6ff-4979-a73f-b5ac1b0b3268:packet_identity",
      "record_type": "packet_identity",
      "schema_version": "1.0.0",
      "status": "kernel_verified",
      "toolchain": {
        "lean_version": "leanprover/lean4:v4.32.0-rc1",
        "mathlib_rev": "360da6fa66c1273b76b6b2d8c5666fd5ac2e3b56"
      },
      "trust_status": "kernel_verified"
    },
    {
      "automation_level": "none",
      "branch_count": 0,
      "created_at": "2026-07-21T23:14:52Z",
      "dependency_composition_depth": 0,
      "environment_hash": "9e26d28efe88484c36562da27aa22a2cc73a0638d11532cbbc9071a60609025d",
      "export_eligibility": "restricted",
      "packet_id": "topology.continuous_id.v1",
      "primary_proof_class": "theorem_lookup",
      "proof_variant_id": "bab11254-b6ff-4979-a73f-b5ac1b0b3268:variant",
      "record_hash": "adb228178707834ffa9524753df94e58ded5c1878285ba0ba3612aed67a9f2b0",
      "record_id": "bab11254-b6ff-4979-a73f-b5ac1b0b3268:proof_profile",
      "record_type": "proof_profile",
      "retrieval_depth": 0,
      "schema_version": "1.0.0",
      "trust_status": "kernel_verified",
      "uses_case_analysis": false,
      "uses_contradiction": false,
      "uses_induction": false,
      "uses_witness_invention": false
    },
    {
      "created_at": "2026-07-21T23:14:52Z",
      "environment_hash": "9e26d28efe88484c36562da27aa22a2cc73a0638d11532cbbc9071a60609025d",
      "export_eligibility": "restricted",
      "obligation_deps": [],
      "packet_id": "topology.continuous_id.v1",
      "proof_variant_id": "bab11254-b6ff-4979-a73f-b5ac1b0b3268:variant",
      "record_hash": "d46f145215b78c634767a179b3180628eee207b71b9eec76a98efe35c35dac85",
      "record_id": "bab11254-b6ff-4979-a73f-b5ac1b0b3268:dependency_manifest",
      "record_type": "dependency_manifest",
      "schema_version": "1.0.0",
      "tactic_tags": [],
      "transitive_dependency_count": 0,
      "transitive_dependency_depth": 0,
      "trust_status": "kernel_verified",
      "used_theorem_deps": []
    },
    {
      "attempt_id": "bab11254-b6ff-4979-a73f-b5ac1b0b3268:attempt",
      "can_export_diagnostics": true,
      "can_export_metadata": true,
      "can_export_model_identity": false,
      "can_export_proof_text": false,
      "candidate_source_ref": null,
      "created_at": "2026-07-21T23:14:52Z",
      "diagnostic_category": "unsolved_goals",
      "environment_hash": "9e26d28efe88484c36562da27aa22a2cc73a0638d11532cbbc9071a60609025d",
      "export_eligibility": "restricted",
      "origin": "controlled_mutation",
      "packet_id": "topology.continuous_id.v1",
      "proof_authority": "none",
      "record_hash": "b6e4b7aedf795fc10798211c11a6a8e43729f5d63e178d821128518fc636dceb",
      "record_id": "bab11254-b6ff-4979-a73f-b5ac1b0b3268:negative:0",
      "record_type": "negative_example",
      "schema_version": "1.0.0",
      "trust_status": "kernel_verified"
    },
    {
      "action": {
        "proof_format": "flat_tactic_sequence",
        "proof_term": "intro \u03b1 inst; exact continuous_id",
        "type": "solve"
      },
      "action_space_version": null,
      "cost": null,
      "created_at": "2026-07-21T23:14:52Z",
      "environment_hash": "9e26d28efe88484c36562da27aa22a2cc73a0638d11532cbbc9071a60609025d",
      "episode_id": "44ba49c4-b182-43c3-aa1d-7328f328ec60",
      "export_eligibility": "restricted",
      "formal_statement_sha256": "8dbabc5eb585cb5e57d7bbe13871dc9952fea30b54c4711586d076fe4354ea1e",
      "lean_cpu_time_ms": null,
      "model_config_hash": null,
      "next_state": {
        "artifact_hash": null,
        "inline": {
          "observation": {
            "state_hash": "28cca6776e79dd4d148e150e6a83e313df0581849ba1e5f87d1c2ad93cc33695",
            "unavailable": true
          },
          "state_hash": "28cca6776e79dd4d148e150e6a83e313df0581849ba1e5f87d1c2ad93cc33695"
        }
      },
      "observation_space_version": null,
      "outcome": "kernel_verified",
      "packet_id": "topology.continuous_id.v1",
      "problem_version_id": "46846296-a9fd-4c6a-bfa8-4f5ff0a67d66",
      "record_hash": "b82954c7f646fff1440d66b83e28877103d8bf777e4968283298d2a523709b1e",
      "record_id": "44ba49c4-b182-43c3-aa1d-7328f328ec60:transition:0",
      "record_type": "rl_transition",
      "restriction_profile_hash": null,
      "restriction_profile_id": null,
      "reward": 2.49,
      "reward_policy_version": "1.0",
      "schema_version": "1.0.0",
      "state": {
        "artifact_hash": null,
        "inline": {
          "observation": {
            "budget": {
              "bytes_per_token": 4,
              "included_bytes": 349,
              "max_observation_bytes": 16000,
              "omitted_bytes": 0,
              "referenced_bytes": 0,
              "truncated": false
            },
            "direct_dependencies": [],
            "direct_dependency_signatures": [],
            "distilled_lesson": null,
            "env_id": "9e26d28efe88484c36562da27aa22a2cc73a0638d11532cbbc9071a60609025d",
            "import_manifest_hash": "aaf21893d520a78dee0787a1bcaf939ee6b922265ff670c272e2e1d450dd29a7",
            "latest_diagnostic": null,
            "obligation_signature": "theorem root_theorem : \u2200 {\u03b1 : Type*} [TopologicalSpace \u03b1], Continuous (id : \u03b1 \u2192 \u03b1)",
            "obligation_statement_hash": "7391161b8033c90e7660253063fd864e2665007ad1c6b5029753ef9dbb825d4b",
            "references": [],
            "retrieved_hint": null,
            "root_theorem_signature": "\u2200 {\u03b1 : Type*} [TopologicalSpace \u03b1], Continuous (id : \u03b1 \u2192 \u03b1)"
          },
          "state_hash": "812ceaea917a489178ab8c7d8a90866f61ea0436c92dd3c93907facbe81121de"
        }
      },
      "step_index": 0,
      "terminated": true,
      "termination_reason": null,
      "tokens": null,
      "truncated": false,
      "truncation_reason": null,
      "trust_status": "kernel_verified",
      "verifier_version": null,
      "wall_time_ms": null
    },
    {
      "created_at": "2026-07-21T23:14:52Z",
      "diagnostic_category": null,
      "environment_hash": "9e26d28efe88484c36562da27aa22a2cc73a0638d11532cbbc9071a60609025d",
      "episode_id": "44ba49c4-b182-43c3-aa1d-7328f328ec60",
      "export_eligibility": "restricted",
      "outcome": "succeeded",
      "packet_id": "topology.continuous_id.v1",
      "record_hash": "31097f14e1bf224f8b2227caf4f78acd4cc51ab1806dfd3393ba99cfa506d6a1",
      "record_id": "bab11254-b6ff-4979-a73f-b5ac1b0b3268:attempt:0",
      "record_type": "attempt_record",
      "schema_version": "1.0.0",
      "trust_status": "kernel_verified"
    }
  ]
}