{
  "bundle_id": "bundle:4512b866-9843-4d10-bbfc-cb3ae6af8f33",
  "created_at": "2026-07-21T23:19:47Z",
  "mcip_version": "1.0.0",
  "producer": "llm-driven-proof-search",
  "records": [
    {
      "created_at": "2026-07-21T23:19:47Z",
      "environment_hash": "9e26d28efe88484c36562da27aa22a2cc73a0638d11532cbbc9071a60609025d",
      "export_eligibility": "restricted",
      "formal_statement_sha256": "d9366313103ff5db8ed085c954b5c82c3261fa27ee8f93e2508734ff7c524211",
      "packet_id": "measure_theory.borel_space_is_open_measurable.v1",
      "packet_version": "1.0.0",
      "record_hash": "d2d7f57d8bec5eb9efeb675c8387e30957e0af2b11d876a003a8275f0c4a03f8",
      "record_id": "4512b866-9843-4d10-bbfc-cb3ae6af8f33:packet_identity",
      "record_type": "packet_identity",
      "schema_version": "1.0.0",
      "status": "kernel_verified",
      "toolchain": {
        "lean_version": "leanprover/lean4:v4.32.0-rc1",
        "mathlib_rev": "360da6fa66c1273b76b6b2d8c5666fd5ac2e3b56"
      },
      "trust_status": "kernel_verified"
    },
    {
      "automation_level": "none",
      "branch_count": 0,
      "created_at": "2026-07-21T23:19:47Z",
      "dependency_composition_depth": 0,
      "environment_hash": "9e26d28efe88484c36562da27aa22a2cc73a0638d11532cbbc9071a60609025d",
      "export_eligibility": "restricted",
      "packet_id": "measure_theory.borel_space_is_open_measurable.v1",
      "primary_proof_class": "theorem_lookup",
      "proof_variant_id": "4512b866-9843-4d10-bbfc-cb3ae6af8f33:variant",
      "record_hash": "8ae532b28815312b652b287bc610486bb42e710c475d2d0bfa2bbeaccb6a7419",
      "record_id": "4512b866-9843-4d10-bbfc-cb3ae6af8f33:proof_profile",
      "record_type": "proof_profile",
      "retrieval_depth": 0,
      "schema_version": "1.0.0",
      "trust_status": "kernel_verified",
      "uses_case_analysis": false,
      "uses_contradiction": false,
      "uses_induction": false,
      "uses_witness_invention": false
    },
    {
      "created_at": "2026-07-21T23:19:47Z",
      "environment_hash": "9e26d28efe88484c36562da27aa22a2cc73a0638d11532cbbc9071a60609025d",
      "export_eligibility": "restricted",
      "obligation_deps": [],
      "packet_id": "measure_theory.borel_space_is_open_measurable.v1",
      "proof_variant_id": "4512b866-9843-4d10-bbfc-cb3ae6af8f33:variant",
      "record_hash": "2942440ddcded56d0e11f4d4aa2b8a08066c9ba8f90fb8b6d49ff090d9c34594",
      "record_id": "4512b866-9843-4d10-bbfc-cb3ae6af8f33:dependency_manifest",
      "record_type": "dependency_manifest",
      "schema_version": "1.0.0",
      "tactic_tags": [],
      "transitive_dependency_count": 0,
      "transitive_dependency_depth": 0,
      "trust_status": "kernel_verified",
      "used_theorem_deps": []
    },
    {
      "attempt_id": "4512b866-9843-4d10-bbfc-cb3ae6af8f33:attempt",
      "can_export_diagnostics": true,
      "can_export_metadata": true,
      "can_export_model_identity": false,
      "can_export_proof_text": false,
      "candidate_source_ref": null,
      "created_at": "2026-07-21T23:19:47Z",
      "diagnostic_category": "unknown_identifier",
      "environment_hash": "9e26d28efe88484c36562da27aa22a2cc73a0638d11532cbbc9071a60609025d",
      "export_eligibility": "restricted",
      "origin": "controlled_mutation",
      "packet_id": "measure_theory.borel_space_is_open_measurable.v1",
      "proof_authority": "none",
      "record_hash": "dfa31f1c06bef8bb298c143aae654b4e8926d85c107a9a40c89f437b74e704a6",
      "record_id": "4512b866-9843-4d10-bbfc-cb3ae6af8f33:negative:0",
      "record_type": "negative_example",
      "schema_version": "1.0.0",
      "trust_status": "kernel_verified"
    },
    {
      "attempt_id": "4512b866-9843-4d10-bbfc-cb3ae6af8f33:attempt",
      "can_export_diagnostics": true,
      "can_export_metadata": true,
      "can_export_model_identity": false,
      "can_export_proof_text": false,
      "candidate_source_ref": null,
      "created_at": "2026-07-21T23:19:47Z",
      "diagnostic_category": "unsolved_goals",
      "environment_hash": "9e26d28efe88484c36562da27aa22a2cc73a0638d11532cbbc9071a60609025d",
      "export_eligibility": "restricted",
      "origin": "controlled_mutation",
      "packet_id": "measure_theory.borel_space_is_open_measurable.v1",
      "proof_authority": "none",
      "record_hash": "2fe0212586836ecce9d9920b1f6d0a32b00d0aa19fc4eefcd782aebeb53af29f",
      "record_id": "4512b866-9843-4d10-bbfc-cb3ae6af8f33:negative:1",
      "record_type": "negative_example",
      "schema_version": "1.0.0",
      "trust_status": "kernel_verified"
    },
    {
      "action": {
        "proof_format": "flat_tactic_sequence",
        "proof_term": "intro \u03b1 instT instM instB s hs; exact hs.measurableSet",
        "type": "solve"
      },
      "action_space_version": null,
      "cost": null,
      "created_at": "2026-07-21T23:19:47Z",
      "environment_hash": "9e26d28efe88484c36562da27aa22a2cc73a0638d11532cbbc9071a60609025d",
      "episode_id": "da23697b-4fa8-4a1d-a69b-d1abddb2bfee",
      "export_eligibility": "restricted",
      "formal_statement_sha256": "d9366313103ff5db8ed085c954b5c82c3261fa27ee8f93e2508734ff7c524211",
      "lean_cpu_time_ms": null,
      "model_config_hash": null,
      "next_state": {
        "artifact_hash": null,
        "inline": {
          "observation": {
            "state_hash": "28cca6776e79dd4d148e150e6a83e313df0581849ba1e5f87d1c2ad93cc33695",
            "unavailable": true
          },
          "state_hash": "28cca6776e79dd4d148e150e6a83e313df0581849ba1e5f87d1c2ad93cc33695"
        }
      },
      "observation_space_version": null,
      "outcome": "kernel_verified",
      "packet_id": "measure_theory.borel_space_is_open_measurable.v1",
      "problem_version_id": "9d1d5427-c744-4559-8971-41812f6128bb",
      "record_hash": "83b3adf099fa49c7451f1c01979d03117077d7c72a01dfd26e02b136469d832f",
      "record_id": "da23697b-4fa8-4a1d-a69b-d1abddb2bfee:transition:0",
      "record_type": "rl_transition",
      "restriction_profile_hash": null,
      "restriction_profile_id": null,
      "reward": 2.49,
      "reward_policy_version": "1.0",
      "schema_version": "1.0.0",
      "state": {
        "artifact_hash": null,
        "inline": {
          "observation": {
            "budget": {
              "bytes_per_token": 4,
              "included_bytes": 451,
              "max_observation_bytes": 16000,
              "omitted_bytes": 0,
              "referenced_bytes": 0,
              "truncated": false
            },
            "direct_dependencies": [],
            "direct_dependency_signatures": [],
            "distilled_lesson": null,
            "env_id": "9e26d28efe88484c36562da27aa22a2cc73a0638d11532cbbc9071a60609025d",
            "import_manifest_hash": "aaf21893d520a78dee0787a1bcaf939ee6b922265ff670c272e2e1d450dd29a7",
            "latest_diagnostic": null,
            "obligation_signature": "theorem root_theorem : \u2200 {\u03b1 : Type*} [TopologicalSpace \u03b1] [MeasurableSpace \u03b1] [BorelSpace \u03b1] {s : Set \u03b1}, IsOpen s \u2192 MeasurableSet s",
            "obligation_statement_hash": "5797050cfb9316036435e2b22313516fd5913a1388a12bc12f51b91303603e6e",
            "references": [],
            "retrieved_hint": null,
            "root_theorem_signature": "\u2200 {\u03b1 : Type*} [TopologicalSpace \u03b1] [MeasurableSpace \u03b1] [BorelSpace \u03b1] {s : Set \u03b1}, IsOpen s \u2192 MeasurableSet s"
          },
          "state_hash": "b5d49e683920da54671a1295c7fc72590fe066d524251201bebbc94e4c0f7242"
        }
      },
      "step_index": 0,
      "terminated": true,
      "termination_reason": null,
      "tokens": null,
      "truncated": false,
      "truncation_reason": null,
      "trust_status": "kernel_verified",
      "verifier_version": null,
      "wall_time_ms": null
    },
    {
      "created_at": "2026-07-21T23:19:47Z",
      "diagnostic_category": null,
      "environment_hash": "9e26d28efe88484c36562da27aa22a2cc73a0638d11532cbbc9071a60609025d",
      "episode_id": "da23697b-4fa8-4a1d-a69b-d1abddb2bfee",
      "export_eligibility": "restricted",
      "outcome": "succeeded",
      "packet_id": "measure_theory.borel_space_is_open_measurable.v1",
      "record_hash": "73bd86908f288c3a8af1863c319983cb5a0e58ca6e8a68953d9cdff9d31e244a",
      "record_id": "4512b866-9843-4d10-bbfc-cb3ae6af8f33:attempt:0",
      "record_type": "attempt_record",
      "schema_version": "1.0.0",
      "trust_status": "kernel_verified"
    }
  ]
}