{
  "bundle_id": "bundle:239913e0-b03c-4ec7-8ebe-922556692290",
  "created_at": "2026-07-23T14:17:14Z",
  "mcip_version": "1.0.0",
  "producer": "llm-driven-proof-search",
  "records": [
    {
      "created_at": "2026-07-23T14:17:14Z",
      "environment_hash": "9e26d28efe88484c36562da27aa22a2cc73a0638d11532cbbc9071a60609025d",
      "export_eligibility": "restricted",
      "formal_statement_sha256": "f8f91184b58559fdcbe3117c68e15a35cb0b80c7e9b5fa5938f9d6a7540a6c99",
      "packet_id": "analysis.metric_space_continuous_dist.v1",
      "packet_version": "1.0.0",
      "record_hash": "95fb4fb954395d897a0758f9569bea5593c401362106b6db52eb694b239155be",
      "record_id": "pi.239913e0-b03c-4ec7-8ebe-922556692290",
      "record_type": "packet_identity",
      "schema_version": "1.0.0",
      "status": "kernel_verified",
      "toolchain": {
        "lean_version": "unknown",
        "mathlib_rev": "unknown"
      },
      "trust_status": "kernel_verified"
    },
    {
      "created_at": "2026-07-23T14:17:14Z",
      "environment_hash": "9e26d28efe88484c36562da27aa22a2cc73a0638d11532cbbc9071a60609025d",
      "export_eligibility": "restricted",
      "formal_statement_sha256": "f8f91184b58559fdcbe3117c68e15a35cb0b80c7e9b5fa5938f9d6a7540a6c99",
      "packet_id": "analysis.metric_space_continuous_dist.v1",
      "proof_body_redacted": false,
      "proof_profile_id": "pv.239913e0-b03c-4ec7-8ebe-922556692290.canonical",
      "record_hash": "9f998ce2df252348bf03590b078b776b2c8a93a2aaced01a688640c3f6019adc",
      "record_id": "pv.239913e0-b03c-4ec7-8ebe-922556692290.canonical",
      "record_type": "proof_variant",
      "schema_version": "1.0.0",
      "source": "proof_search",
      "trust_status": "kernel_verified",
      "variant_style": "canonical"
    },
    {
      "automation_level": "none",
      "branch_count": 0,
      "created_at": "2026-07-23T14:17:14Z",
      "dependency_composition_depth": 0,
      "environment_hash": "9e26d28efe88484c36562da27aa22a2cc73a0638d11532cbbc9071a60609025d",
      "export_eligibility": "restricted",
      "packet_id": "analysis.metric_space_continuous_dist.v1",
      "primary_proof_class": "theorem_lookup",
      "proof_variant_id": "pv.239913e0-b03c-4ec7-8ebe-922556692290.canonical",
      "record_hash": "412c48a713344a529dd2544ec544fcfe2d63817145532a12ee9ec1b9c67d3561",
      "record_id": "pp.239913e0-b03c-4ec7-8ebe-922556692290",
      "record_type": "proof_profile",
      "retrieval_depth": 0,
      "schema_version": "1.0.0",
      "trust_status": "kernel_verified",
      "uses_case_analysis": false,
      "uses_contradiction": false,
      "uses_induction": false,
      "uses_witness_invention": false
    },
    {
      "created_at": "2026-07-23T14:17:14Z",
      "environment_hash": "9e26d28efe88484c36562da27aa22a2cc73a0638d11532cbbc9071a60609025d",
      "export_eligibility": "restricted",
      "obligation_deps": [],
      "packet_id": "analysis.metric_space_continuous_dist.v1",
      "proof_variant_id": "pv.239913e0-b03c-4ec7-8ebe-922556692290.canonical",
      "record_hash": "eca7c3c9e1a86ca0fc2829bb205386d6b0142f9143476aa9440463cf4e14497e",
      "record_id": "dm.239913e0-b03c-4ec7-8ebe-922556692290",
      "record_type": "dependency_manifest",
      "schema_version": "1.0.0",
      "tactic_tags": [],
      "transitive_dependency_count": 0,
      "transitive_dependency_depth": 0,
      "trust_status": "kernel_verified",
      "used_theorem_deps": []
    },
    {
      "created_at": "2026-07-23T14:17:14Z",
      "diagnostic_category": null,
      "environment_hash": "9e26d28efe88484c36562da27aa22a2cc73a0638d11532cbbc9071a60609025d",
      "episode_id": "fd19fda7-1f07-417f-83ee-222015e143e2",
      "export_eligibility": "restricted",
      "outcome": "succeeded",
      "packet_id": "analysis.metric_space_continuous_dist.v1",
      "record_hash": "62b84156b3f72ab4a4c0ed2ec222297ba3aa07900ff1121aa167d6ba8bd4c429",
      "record_id": "ar.7669f667-6433-4e46-a37b-c1d903c4ac0d",
      "record_type": "attempt_record",
      "schema_version": "1.0.0",
      "trust_status": "kernel_verified"
    },
    {
      "attempt_id": "ar.7669f667-6433-4e46-a37b-c1d903c4ac0d",
      "can_export_diagnostics": true,
      "can_export_metadata": true,
      "can_export_model_identity": false,
      "can_export_proof_text": false,
      "candidate_source_ref": null,
      "created_at": "2026-07-23T14:17:14Z",
      "diagnostic_category": "unknown_identifier",
      "environment_hash": "9e26d28efe88484c36562da27aa22a2cc73a0638d11532cbbc9071a60609025d",
      "export_eligibility": "restricted",
      "origin": "controlled_mutation",
      "packet_id": "analysis.metric_space_continuous_dist.v1",
      "proof_authority": "none",
      "record_hash": "6ea7dac84cd29f192cca2c79c0673b27189d77e8942023e5a8fcb29f3ccaa12d",
      "record_id": "neg.239913e0-b03c-4ec7-8ebe-922556692290.0",
      "record_type": "negative_example",
      "schema_version": "1.0.0",
      "trust_status": "kernel_verified"
    },
    {
      "attempt_id": "ar.7669f667-6433-4e46-a37b-c1d903c4ac0d",
      "can_export_diagnostics": true,
      "can_export_metadata": true,
      "can_export_model_identity": false,
      "can_export_proof_text": false,
      "candidate_source_ref": null,
      "created_at": "2026-07-23T14:17:14Z",
      "diagnostic_category": "unsolved_goals",
      "environment_hash": "9e26d28efe88484c36562da27aa22a2cc73a0638d11532cbbc9071a60609025d",
      "export_eligibility": "restricted",
      "origin": "controlled_mutation",
      "packet_id": "analysis.metric_space_continuous_dist.v1",
      "proof_authority": "none",
      "record_hash": "50666b304e567b9f31b190ac35f6411a57e3c38360e09ceb44083f5ef5288124",
      "record_id": "neg.239913e0-b03c-4ec7-8ebe-922556692290.1",
      "record_type": "negative_example",
      "schema_version": "1.0.0",
      "trust_status": "kernel_verified"
    },
    {
      "action": {
        "proof_format": "flat_tactic_sequence",
        "proof_term": "intro X inst p; exact continuous_id.dist continuous_const",
        "type": "solve"
      },
      "action_space_version": null,
      "cost": null,
      "created_at": "2026-07-23T14:17:14Z",
      "environment_hash": "9e26d28efe88484c36562da27aa22a2cc73a0638d11532cbbc9071a60609025d",
      "episode_id": "fd19fda7-1f07-417f-83ee-222015e143e2",
      "export_eligibility": "restricted",
      "formal_statement_sha256": "f8f91184b58559fdcbe3117c68e15a35cb0b80c7e9b5fa5938f9d6a7540a6c99",
      "lean_cpu_time_ms": null,
      "model_config_hash": null,
      "next_state": {
        "artifact_hash": null,
        "inline": {
          "observation": {
            "state_hash": "28cca6776e79dd4d148e150e6a83e313df0581849ba1e5f87d1c2ad93cc33695",
            "unavailable": true
          },
          "state_hash": "28cca6776e79dd4d148e150e6a83e313df0581849ba1e5f87d1c2ad93cc33695"
        }
      },
      "observation_space_version": null,
      "outcome": "kernel_verified",
      "packet_id": "analysis.metric_space_continuous_dist.v1",
      "problem_version_id": "0195f494-3256-425a-9009-f872bfd9173b",
      "record_hash": "4f42a2ea251b4b2ddaf5f7c6709bace7b7b29ba9e23254e99539f50fb93b1e01",
      "record_id": "tr.fd19fda7-1f07-417f-83ee-222015e143e2.0",
      "record_type": "rl_transition",
      "restriction_profile_hash": null,
      "restriction_profile_id": null,
      "reward": 2.49,
      "reward_policy_version": "1.0",
      "schema_version": "1.0.0",
      "state": {
        "artifact_hash": null,
        "inline": {
          "observation": {
            "budget": {
              "bytes_per_token": 4,
              "included_bytes": 357,
              "max_observation_bytes": 16000,
              "omitted_bytes": 0,
              "referenced_bytes": 0,
              "truncated": false
            },
            "direct_dependencies": [],
            "direct_dependency_signatures": [],
            "distilled_lesson": null,
            "env_id": "9e26d28efe88484c36562da27aa22a2cc73a0638d11532cbbc9071a60609025d",
            "import_manifest_hash": "aaf21893d520a78dee0787a1bcaf939ee6b922265ff670c272e2e1d450dd29a7",
            "latest_diagnostic": null,
            "obligation_signature": "theorem root_theorem : ∀ {X : Type*} [MetricSpace X] (p : X), Continuous (fun x => dist x p)",
            "obligation_statement_hash": "b2248a2010fb91256a3efdc2264474519514919cf3d6f19487f97761d691fb1f",
            "references": [],
            "retrieved_hint": null,
            "root_theorem_signature": "∀ {X : Type*} [MetricSpace X] (p : X), Continuous (fun x => dist x p)"
          },
          "state_hash": "33f828f0fde4465fce684b43665c64d828a87230cd14fa88e854c140ae4b7528"
        }
      },
      "step_index": 0,
      "terminated": true,
      "termination_reason": null,
      "tokens": null,
      "truncated": false,
      "truncation_reason": null,
      "trust_status": "kernel_verified",
      "verifier_version": null,
      "wall_time_ms": null
    }
  ]
}