{
  "mcip_version": "1.0.0",
  "bundle_id": "fixture.repair_chain.v1",
  "created_at": "2026-07-11T00:00:00Z",
  "producer": "llm-driven-proof-search",
  "records": [
    {
      "schema_version": "1.0.0",
      "record_type": "packet_identity",
      "record_id": "pi.repair_example.1",
      "packet_id": "elementary.algebra.add_assoc.v1",
      "environment_hash": "9e26d28efe88484c36562da27aa22a2cc73a0638d11532cbbc9071a60609025d",
      "created_at": "2026-07-11T00:00:00Z",
      "trust_status": "kernel_verified",
      "export_eligibility": "public",
      "packet_version": "1.0.0",
      "formal_statement_sha256": "b90182e61b67b4c1f0c7706c0265f96a2db4ffd7cbf629202d37f4adb1f503f7",
      "status": "kernel_verified",
      "record_hash": "8d2c5fd0ef35d4c7ee458e802c492fa86eb9384ce9bf58b9c029ae61493d5d6c"
    },
    {
      "schema_version": "1.0.0",
      "record_type": "attempt_record",
      "record_id": "ar.repair_example.failed",
      "packet_id": "elementary.algebra.add_assoc.v1",
      "environment_hash": "9e26d28efe88484c36562da27aa22a2cc73a0638d11532cbbc9071a60609025d",
      "created_at": "2026-07-11T00:00:00Z",
      "trust_status": "tracked_episode",
      "export_eligibility": "restricted",
      "proof_variant_id": null,
      "episode_id": "cafe1234-2222-4b22-9b22-222222222222",
      "outcome": "failed",
      "diagnostic_category": "unsolved_goals",
      "diagnostics": [
        {
          "category": "unsolved_goals",
          "message": "unsolved goals",
          "source_span": "line 2, col 2",
          "goals": [
            "⊢ a + b + c = a + (b + c)"
          ],
          "local_context": [
            "a b c : ℤ"
          ],
          "unsolved_goals": [
            "⊢ a + b + c = a + (b + c)"
          ]
        }
      ],
      "tokens": 150,
      "cost": 0.0011,
      "wall_time_ms": 300.0,
      "lean_cpu_time_ms": 60.0,
      "model_run_id": "mr.proofsearch.2026_07",
      "model_config_hash": "4758564a6444ab6a4e46d3604a1bcf8cb9d4004ce83994967d687bc74837922a",
      "prompt_hash": "16eb2659de583ce38a288c3939a9b9a59cd83355aa76d537b6b60bcfb0c394a4",
      "context_hash": "afe59cd36b183ccfcc71fa7dd8eb7e07ebaf5555eb7ba1ae0979f5269de6f723",
      "public_metadata": {
        "summary": "First attempt closed the wrong associativity direction."
      },
      "record_hash": "53786857ff26bd3983513791a683afb1f0a23087c4eb485ed69bd3561df91099"
    },
    {
      "schema_version": "1.0.0",
      "record_type": "proof_variant",
      "record_id": "pv.repair_example.canonical",
      "packet_id": "elementary.algebra.add_assoc.v1",
      "environment_hash": "9e26d28efe88484c36562da27aa22a2cc73a0638d11532cbbc9071a60609025d",
      "created_at": "2026-07-11T00:00:00Z",
      "trust_status": "kernel_verified",
      "export_eligibility": "public",
      "formal_statement_sha256": "b90182e61b67b4c1f0c7706c0265f96a2db4ffd7cbf629202d37f4adb1f503f7",
      "variant_style": "canonical",
      "proof_body_sha256": "8c15b9cb8d16b29111be6c27d02deaf15b8ed70cb03cc48dbceacb4826466f4d",
      "proof_body_redacted": false,
      "tactic_count": 1,
      "proof_length": 1,
      "restriction_profile_id": null,
      "restriction_profile_hash": null,
      "proof_profile_id": null,
      "model_run_id": "mr.proofsearch.2026_07",
      "source": "proof_search",
      "record_hash": "bc94fe78f78a6f6226c8bdbac94c539e71ca6b1438220c8828e319e5e1603cc7"
    },
    {
      "schema_version": "1.0.0",
      "record_type": "attempt_record",
      "record_id": "ar.repair_example.succeeded",
      "packet_id": "elementary.algebra.add_assoc.v1",
      "environment_hash": "9e26d28efe88484c36562da27aa22a2cc73a0638d11532cbbc9071a60609025d",
      "created_at": "2026-07-11T00:00:00Z",
      "trust_status": "kernel_verified",
      "export_eligibility": "public",
      "proof_variant_id": "pv.repair_example.canonical",
      "episode_id": "cafe1234-2222-4b22-9b22-222222222222",
      "outcome": "succeeded",
      "diagnostic_category": null,
      "diagnostics": [],
      "tokens": 180,
      "cost": 0.0013,
      "wall_time_ms": 340.0,
      "lean_cpu_time_ms": 70.0,
      "model_run_id": "mr.proofsearch.2026_07",
      "model_config_hash": "4758564a6444ab6a4e46d3604a1bcf8cb9d4004ce83994967d687bc74837922a",
      "prompt_hash": "adb018a708e8a18ecaae13115350c52930180a9456fb6be2e1aef7b156289704",
      "context_hash": "7d8f42f4fb193331aafa8af3a4a4f063f685d33089cd249fcd9b17518a72711c",
      "public_metadata": {
        "summary": "Repaired by swapping to `add_assoc` directly."
      },
      "record_hash": "6f24a5ae6e8f7bc717588d2d7bb83e806bf28f09c3084d7a2029c8dc1d68a8d5"
    },
    {
      "schema_version": "1.0.0",
      "record_type": "repair_trajectory",
      "record_id": "rt.repair_example.1",
      "packet_id": "elementary.algebra.add_assoc.v1",
      "environment_hash": "9e26d28efe88484c36562da27aa22a2cc73a0638d11532cbbc9071a60609025d",
      "created_at": "2026-07-11T00:00:00Z",
      "trust_status": "kernel_verified",
      "export_eligibility": "public",
      "steps": [
        {
          "step_index": 0,
          "from_attempt_id": "ar.repair_example.failed",
          "repair_action": "swap `add_comm` for `add_assoc` to match the goal direction",
          "diagnostic_category_addressed": "unsolved_goals",
          "to_ref": "ar.repair_example.succeeded",
          "step_hash": "fde201d6534718896630d2bcfb7289f21938e8975ced20a7108d49777fb4f029"
        }
      ],
      "terminal_outcome": "verified_proof",
      "terminal_ref": "pv.repair_example.canonical",
      "record_hash": "4b09aa0181b1144cc9504499e0d4d598683cebb8526bc2936efcffcfdd05bc7d"
    }
  ]
}
