{
  "bundle_id": "bundle:3cf931b9-4498-4753-ad18-d8ab0567d608",
  "created_at": "2026-07-23T14:17:14Z",
  "mcip_version": "1.0.0",
  "producer": "llm-driven-proof-search",
  "records": [
    {
      "created_at": "2026-07-23T14:17:14Z",
      "environment_hash": "9e26d28efe88484c36562da27aa22a2cc73a0638d11532cbbc9071a60609025d",
      "export_eligibility": "restricted",
      "formal_statement_sha256": "3ef4b5460f1e682d6500b164f2f1188ca71c9e4a880aef4691bc4b27c2e2da5b",
      "packet_id": "elementary.logic.union_pair_element.v1",
      "packet_version": "1.0.0",
      "record_hash": "3d3db3e9241e10e1c3de2465aeda6c1fc4c561696b7297b34b98c39cc71b2f70",
      "record_id": "pi.3cf931b9-4498-4753-ad18-d8ab0567d608",
      "record_type": "packet_identity",
      "schema_version": "1.0.0",
      "status": "kernel_verified",
      "toolchain": {
        "lean_version": "unknown",
        "mathlib_rev": "unknown"
      },
      "trust_status": "kernel_verified"
    },
    {
      "created_at": "2026-07-23T14:17:14Z",
      "environment_hash": "9e26d28efe88484c36562da27aa22a2cc73a0638d11532cbbc9071a60609025d",
      "export_eligibility": "restricted",
      "formal_statement_sha256": "3ef4b5460f1e682d6500b164f2f1188ca71c9e4a880aef4691bc4b27c2e2da5b",
      "packet_id": "elementary.logic.union_pair_element.v1",
      "proof_body_redacted": false,
      "proof_profile_id": "pv.3cf931b9-4498-4753-ad18-d8ab0567d608.canonical",
      "record_hash": "2e98a7cae2c676ece66eb8a67484876e2ab49892d1c95685c388b0453c00d14b",
      "record_id": "pv.3cf931b9-4498-4753-ad18-d8ab0567d608.canonical",
      "record_type": "proof_variant",
      "schema_version": "1.0.0",
      "source": "proof_search",
      "trust_status": "kernel_verified",
      "variant_style": "canonical"
    },
    {
      "automation_level": "none",
      "branch_count": 1,
      "created_at": "2026-07-23T14:17:14Z",
      "dependency_composition_depth": 0,
      "environment_hash": "9e26d28efe88484c36562da27aa22a2cc73a0638d11532cbbc9071a60609025d",
      "export_eligibility": "restricted",
      "packet_id": "elementary.logic.union_pair_element.v1",
      "primary_proof_class": "case_analysis",
      "proof_variant_id": "pv.3cf931b9-4498-4753-ad18-d8ab0567d608.canonical",
      "record_hash": "48495f2d6e0ee4436fd849ae5b0434033b15a22473d1c6baa1b9af7a9eac2694",
      "record_id": "pp.3cf931b9-4498-4753-ad18-d8ab0567d608",
      "record_type": "proof_profile",
      "retrieval_depth": 0,
      "schema_version": "1.0.0",
      "secondary_proof_classes": [
        "witness_construction"
      ],
      "trust_status": "kernel_verified",
      "uses_case_analysis": true,
      "uses_contradiction": false,
      "uses_induction": false,
      "uses_witness_invention": true
    },
    {
      "created_at": "2026-07-23T14:17:14Z",
      "environment_hash": "9e26d28efe88484c36562da27aa22a2cc73a0638d11532cbbc9071a60609025d",
      "export_eligibility": "restricted",
      "obligation_deps": [],
      "packet_id": "elementary.logic.union_pair_element.v1",
      "proof_variant_id": "pv.3cf931b9-4498-4753-ad18-d8ab0567d608.canonical",
      "record_hash": "47175ecd201974cb1e332209a7b3cd1a7fc2ec05f0ec9a769c56b8cb30f1b2d9",
      "record_id": "dm.3cf931b9-4498-4753-ad18-d8ab0567d608",
      "record_type": "dependency_manifest",
      "schema_version": "1.0.0",
      "tactic_tags": [],
      "transitive_dependency_count": 0,
      "transitive_dependency_depth": 0,
      "trust_status": "kernel_verified",
      "used_theorem_deps": []
    },
    {
      "created_at": "2026-07-23T14:17:14Z",
      "diagnostic_category": null,
      "environment_hash": "9e26d28efe88484c36562da27aa22a2cc73a0638d11532cbbc9071a60609025d",
      "episode_id": "a478fec4-f715-4432-a593-cbdd95dde1f4",
      "export_eligibility": "restricted",
      "outcome": "succeeded",
      "packet_id": "elementary.logic.union_pair_element.v1",
      "record_hash": "02e6c320ef6cf1e45db157bca9e0e9b34e174ee8098808b0fe3094437f96008a",
      "record_id": "ar.b545d1f0-b68f-433b-bd04-0e2684e6c158",
      "record_type": "attempt_record",
      "schema_version": "1.0.0",
      "trust_status": "kernel_verified"
    },
    {
      "attempt_id": "ar.b545d1f0-b68f-433b-bd04-0e2684e6c158",
      "can_export_diagnostics": true,
      "can_export_metadata": true,
      "can_export_model_identity": false,
      "can_export_proof_text": false,
      "candidate_source_ref": null,
      "created_at": "2026-07-23T14:17:14Z",
      "diagnostic_category": "unknown_identifier",
      "environment_hash": "9e26d28efe88484c36562da27aa22a2cc73a0638d11532cbbc9071a60609025d",
      "export_eligibility": "restricted",
      "origin": "controlled_mutation",
      "packet_id": "elementary.logic.union_pair_element.v1",
      "proof_authority": "none",
      "record_hash": "5211225a90581c6affe49ec531dba7fe8fd63b4b8f57a22c70c587d2aaf175b2",
      "record_id": "neg.3cf931b9-4498-4753-ad18-d8ab0567d608.0",
      "record_type": "negative_example",
      "schema_version": "1.0.0",
      "trust_status": "kernel_verified"
    },
    {
      "attempt_id": "ar.b545d1f0-b68f-433b-bd04-0e2684e6c158",
      "can_export_diagnostics": true,
      "can_export_metadata": true,
      "can_export_model_identity": false,
      "can_export_proof_text": false,
      "candidate_source_ref": null,
      "created_at": "2026-07-23T14:17:14Z",
      "diagnostic_category": "unsolved_goals",
      "environment_hash": "9e26d28efe88484c36562da27aa22a2cc73a0638d11532cbbc9071a60609025d",
      "export_eligibility": "restricted",
      "origin": "controlled_mutation",
      "packet_id": "elementary.logic.union_pair_element.v1",
      "proof_authority": "none",
      "record_hash": "513cfa88a87cfe19e49f6d422a8ae89af895f23274c95bcc667689603c0b1caf",
      "record_id": "neg.3cf931b9-4498-4753-ad18-d8ab0567d608.1",
      "record_type": "negative_example",
      "schema_version": "1.0.0",
      "trust_status": "kernel_verified"
    },
    {
      "action": {
        "proof_format": "flat_tactic_sequence",
        "proof_term": "intro α inst A B hA; obtain ⟨x, hx⟩ := hA; use x; exact Finset.mem_union_left B hx",
        "type": "solve"
      },
      "action_space_version": null,
      "cost": null,
      "created_at": "2026-07-23T14:17:14Z",
      "environment_hash": "9e26d28efe88484c36562da27aa22a2cc73a0638d11532cbbc9071a60609025d",
      "episode_id": "a478fec4-f715-4432-a593-cbdd95dde1f4",
      "export_eligibility": "restricted",
      "formal_statement_sha256": "3ef4b5460f1e682d6500b164f2f1188ca71c9e4a880aef4691bc4b27c2e2da5b",
      "lean_cpu_time_ms": null,
      "model_config_hash": null,
      "next_state": {
        "artifact_hash": null,
        "inline": {
          "observation": {
            "state_hash": "28cca6776e79dd4d148e150e6a83e313df0581849ba1e5f87d1c2ad93cc33695",
            "unavailable": true
          },
          "state_hash": "28cca6776e79dd4d148e150e6a83e313df0581849ba1e5f87d1c2ad93cc33695"
        }
      },
      "observation_space_version": null,
      "outcome": "kernel_verified",
      "packet_id": "elementary.logic.union_pair_element.v1",
      "problem_version_id": "3234a527-a1c6-40cd-a4bc-37faedd77b76",
      "record_hash": "93467998cdbea21ba7745536bbda060fd8944a0b4518268fedc98a0810514248",
      "record_id": "tr.a478fec4-f715-4432-a593-cbdd95dde1f4.0",
      "record_type": "rl_transition",
      "restriction_profile_hash": null,
      "restriction_profile_id": null,
      "reward": 2.49,
      "reward_policy_version": "1.0",
      "schema_version": "1.0.0",
      "state": {
        "artifact_hash": null,
        "inline": {
          "observation": {
            "budget": {
              "bytes_per_token": 4,
              "included_bytes": 391,
              "max_observation_bytes": 16000,
              "omitted_bytes": 0,
              "referenced_bytes": 0,
              "truncated": false
            },
            "direct_dependencies": [],
            "direct_dependency_signatures": [],
            "distilled_lesson": null,
            "env_id": "9e26d28efe88484c36562da27aa22a2cc73a0638d11532cbbc9071a60609025d",
            "import_manifest_hash": "aaf21893d520a78dee0787a1bcaf939ee6b922265ff670c272e2e1d450dd29a7",
            "latest_diagnostic": null,
            "obligation_signature": "theorem root_theorem : ∀ {α : Type*} [DecidableEq α] (A B : Finset α), A.Nonempty → ∃ x, x ∈ A ∪ B",
            "obligation_statement_hash": "180b0f8328843f40bea350e17414b2f77d516cc342caa79460fd7f42944ab613",
            "references": [],
            "retrieved_hint": null,
            "root_theorem_signature": "∀ {α : Type*} [DecidableEq α] (A B : Finset α), A.Nonempty → ∃ x, x ∈ A ∪ B"
          },
          "state_hash": "7427f9d87c1bf740572dba5b5600bf5a4fa17564c2c1e88317343972958be9c8"
        }
      },
      "step_index": 0,
      "terminated": true,
      "termination_reason": null,
      "tokens": null,
      "truncated": false,
      "truncation_reason": null,
      "trust_status": "kernel_verified",
      "verifier_version": null,
      "wall_time_ms": null
    }
  ]
}