{
  "bundle_id": "bundle:b31a2457-17b4-4f0c-863c-c6ffae38dbee",
  "created_at": "2026-07-21T23:22:18Z",
  "mcip_version": "1.0.0",
  "producer": "llm-driven-proof-search",
  "records": [
    {
      "created_at": "2026-07-21T23:22:18Z",
      "environment_hash": "9e26d28efe88484c36562da27aa22a2cc73a0638d11532cbbc9071a60609025d",
      "export_eligibility": "restricted",
      "formal_statement_sha256": "3b356c61fd06a83d34a8ffa1f6afbce4de23fd486479ec2ea0f956b866d2eb49",
      "packet_id": "algebra.group_hom_kernel_subgroup.v1",
      "packet_version": "1.0.0",
      "record_hash": "8663bed85f97cf258fa51fbbfbff2a203b5d597ac834b2dc6a6455b58f2a27d8",
      "record_id": "b31a2457-17b4-4f0c-863c-c6ffae38dbee:packet_identity",
      "record_type": "packet_identity",
      "schema_version": "1.0.0",
      "status": "kernel_verified",
      "toolchain": {
        "lean_version": "leanprover/lean4:v4.32.0-rc1",
        "mathlib_rev": "360da6fa66c1273b76b6b2d8c5666fd5ac2e3b56"
      },
      "trust_status": "kernel_verified"
    },
    {
      "automation_level": "none",
      "branch_count": 0,
      "created_at": "2026-07-21T23:22:18Z",
      "dependency_composition_depth": 0,
      "environment_hash": "9e26d28efe88484c36562da27aa22a2cc73a0638d11532cbbc9071a60609025d",
      "export_eligibility": "restricted",
      "packet_id": "algebra.group_hom_kernel_subgroup.v1",
      "primary_proof_class": "theorem_lookup",
      "proof_variant_id": "b31a2457-17b4-4f0c-863c-c6ffae38dbee:variant",
      "record_hash": "428a65ad857b891f6f690f8d1d66317ce5749590136933fbda4e03f2e9ad5b83",
      "record_id": "b31a2457-17b4-4f0c-863c-c6ffae38dbee:proof_profile",
      "record_type": "proof_profile",
      "retrieval_depth": 0,
      "schema_version": "1.0.0",
      "trust_status": "kernel_verified",
      "uses_case_analysis": false,
      "uses_contradiction": false,
      "uses_induction": false,
      "uses_witness_invention": false
    },
    {
      "created_at": "2026-07-21T23:22:18Z",
      "environment_hash": "9e26d28efe88484c36562da27aa22a2cc73a0638d11532cbbc9071a60609025d",
      "export_eligibility": "restricted",
      "obligation_deps": [],
      "packet_id": "algebra.group_hom_kernel_subgroup.v1",
      "proof_variant_id": "b31a2457-17b4-4f0c-863c-c6ffae38dbee:variant",
      "record_hash": "e7501615f4dad5ae7259b00f22ca7f59ca759bf8a0ab01c907a13a5ed6e96c16",
      "record_id": "b31a2457-17b4-4f0c-863c-c6ffae38dbee:dependency_manifest",
      "record_type": "dependency_manifest",
      "schema_version": "1.0.0",
      "tactic_tags": [],
      "transitive_dependency_count": 0,
      "transitive_dependency_depth": 0,
      "trust_status": "kernel_verified",
      "used_theorem_deps": []
    },
    {
      "attempt_id": "b31a2457-17b4-4f0c-863c-c6ffae38dbee:attempt",
      "can_export_diagnostics": true,
      "can_export_metadata": true,
      "can_export_model_identity": false,
      "can_export_proof_text": false,
      "candidate_source_ref": null,
      "created_at": "2026-07-21T23:22:18Z",
      "diagnostic_category": "unsolved_goals",
      "environment_hash": "9e26d28efe88484c36562da27aa22a2cc73a0638d11532cbbc9071a60609025d",
      "export_eligibility": "restricted",
      "origin": "controlled_mutation",
      "packet_id": "algebra.group_hom_kernel_subgroup.v1",
      "proof_authority": "none",
      "record_hash": "93c2b8f6d846786308712810d1deab9036f488ac4ea5c31f508407ca1bb405a8",
      "record_id": "b31a2457-17b4-4f0c-863c-c6ffae38dbee:negative:0",
      "record_type": "negative_example",
      "schema_version": "1.0.0",
      "trust_status": "kernel_verified"
    },
    {
      "action": {
        "proof_format": "flat_tactic_sequence",
        "proof_term": "intro G H instG instH f; exact map_one f",
        "type": "solve"
      },
      "action_space_version": null,
      "cost": null,
      "created_at": "2026-07-21T23:22:18Z",
      "environment_hash": "9e26d28efe88484c36562da27aa22a2cc73a0638d11532cbbc9071a60609025d",
      "episode_id": "7045be23-4f9a-4ecf-aa69-cb2862753e9c",
      "export_eligibility": "restricted",
      "formal_statement_sha256": "3b356c61fd06a83d34a8ffa1f6afbce4de23fd486479ec2ea0f956b866d2eb49",
      "lean_cpu_time_ms": null,
      "model_config_hash": null,
      "next_state": {
        "artifact_hash": null,
        "inline": {
          "observation": {
            "state_hash": "28cca6776e79dd4d148e150e6a83e313df0581849ba1e5f87d1c2ad93cc33695",
            "unavailable": true
          },
          "state_hash": "28cca6776e79dd4d148e150e6a83e313df0581849ba1e5f87d1c2ad93cc33695"
        }
      },
      "observation_space_version": null,
      "outcome": "kernel_verified",
      "packet_id": "algebra.group_hom_kernel_subgroup.v1",
      "problem_version_id": "5c9c9a73-8758-4290-b07d-b4a801368c57",
      "record_hash": "4d58aebfb10e0ff6a629b4416d767e6b765532499689d8f8bfdb42bad376cb62",
      "record_id": "7045be23-4f9a-4ecf-aa69-cb2862753e9c:transition:0",
      "record_type": "rl_transition",
      "restriction_profile_hash": null,
      "restriction_profile_id": null,
      "reward": 2.49,
      "reward_policy_version": "1.0",
      "schema_version": "1.0.0",
      "state": {
        "artifact_hash": null,
        "inline": {
          "observation": {
            "budget": {
              "bytes_per_token": 4,
              "included_bytes": 337,
              "max_observation_bytes": 16000,
              "omitted_bytes": 0,
              "referenced_bytes": 0,
              "truncated": false
            },
            "direct_dependencies": [],
            "direct_dependency_signatures": [],
            "distilled_lesson": null,
            "env_id": "9e26d28efe88484c36562da27aa22a2cc73a0638d11532cbbc9071a60609025d",
            "import_manifest_hash": "aaf21893d520a78dee0787a1bcaf939ee6b922265ff670c272e2e1d450dd29a7",
            "latest_diagnostic": null,
            "obligation_signature": "theorem root_theorem : \u2200 {G H : Type*} [Group G] [Group H] (f : G \u2192* H), f 1 = 1",
            "obligation_statement_hash": "2a49922083b31f697cca5b3fde73c558b9b4931811cfb731bf8009d023e8056b",
            "references": [],
            "retrieved_hint": null,
            "root_theorem_signature": "\u2200 {G H : Type*} [Group G] [Group H] (f : G \u2192* H), f 1 = 1"
          },
          "state_hash": "e2542053061d8af2838c397280f4d51b76c5698fb18bc40d0cbc9cd7aa3a9b9e"
        }
      },
      "step_index": 0,
      "terminated": true,
      "termination_reason": null,
      "tokens": null,
      "truncated": false,
      "truncation_reason": null,
      "trust_status": "kernel_verified",
      "verifier_version": null,
      "wall_time_ms": null
    },
    {
      "created_at": "2026-07-21T23:22:18Z",
      "diagnostic_category": null,
      "environment_hash": "9e26d28efe88484c36562da27aa22a2cc73a0638d11532cbbc9071a60609025d",
      "episode_id": "7045be23-4f9a-4ecf-aa69-cb2862753e9c",
      "export_eligibility": "restricted",
      "outcome": "succeeded",
      "packet_id": "algebra.group_hom_kernel_subgroup.v1",
      "record_hash": "55a0cc987cc7b8e32071a106dcc2e5c2f0ff497dd0f49eb90d0ed256a93a89fd",
      "record_id": "b31a2457-17b4-4f0c-863c-c6ffae38dbee:attempt:0",
      "record_type": "attempt_record",
      "schema_version": "1.0.0",
      "trust_status": "kernel_verified"
    }
  ]
}