{
  "bundle_id": "bundle:f81ecb7c-4902-4c02-bf40-58a90987a479",
  "created_at": "2026-07-23T14:17:13Z",
  "mcip_version": "1.0.0",
  "producer": "llm-driven-proof-search",
  "records": [
    {
      "created_at": "2026-07-23T14:17:13Z",
      "environment_hash": "9e26d28efe88484c36562da27aa22a2cc73a0638d11532cbbc9071a60609025d",
      "export_eligibility": "restricted",
      "formal_statement_sha256": "df6af0321aafea4c6982aef0688cc7c405af9493a3d79188509124fcd46f2fd1",
      "packet_id": "logic.functions.injective_comp_self.v1",
      "packet_version": "1.0.0",
      "record_hash": "2e3a4bd17ea6a760224a34ad4c8c3385ab8485073d58a433720d678b99cdbbc8",
      "record_id": "pi.f81ecb7c-4902-4c02-bf40-58a90987a479",
      "record_type": "packet_identity",
      "schema_version": "1.0.0",
      "status": "kernel_verified",
      "toolchain": {
        "lean_version": "unknown",
        "mathlib_rev": "unknown"
      },
      "trust_status": "kernel_verified"
    },
    {
      "created_at": "2026-07-23T14:17:13Z",
      "environment_hash": "9e26d28efe88484c36562da27aa22a2cc73a0638d11532cbbc9071a60609025d",
      "export_eligibility": "restricted",
      "formal_statement_sha256": "df6af0321aafea4c6982aef0688cc7c405af9493a3d79188509124fcd46f2fd1",
      "packet_id": "logic.functions.injective_comp_self.v1",
      "proof_body_redacted": false,
      "proof_profile_id": "pv.f81ecb7c-4902-4c02-bf40-58a90987a479.canonical",
      "record_hash": "bedd76d639d3a87e62fe5f5c06088dff48877df85553a6106fdd81728923cedc",
      "record_id": "pv.f81ecb7c-4902-4c02-bf40-58a90987a479.canonical",
      "record_type": "proof_variant",
      "schema_version": "1.0.0",
      "source": "proof_search",
      "trust_status": "kernel_verified",
      "variant_style": "canonical"
    },
    {
      "automation_level": "none",
      "branch_count": 0,
      "created_at": "2026-07-23T14:17:13Z",
      "dependency_composition_depth": 0,
      "environment_hash": "9e26d28efe88484c36562da27aa22a2cc73a0638d11532cbbc9071a60609025d",
      "export_eligibility": "restricted",
      "packet_id": "logic.functions.injective_comp_self.v1",
      "primary_proof_class": "theorem_lookup",
      "proof_variant_id": "pv.f81ecb7c-4902-4c02-bf40-58a90987a479.canonical",
      "record_hash": "55b0a5003c841387c622cb510c9c56139653ff0d1886de6408eca678c8f048fc",
      "record_id": "pp.f81ecb7c-4902-4c02-bf40-58a90987a479",
      "record_type": "proof_profile",
      "retrieval_depth": 0,
      "schema_version": "1.0.0",
      "trust_status": "kernel_verified",
      "uses_case_analysis": false,
      "uses_contradiction": false,
      "uses_induction": false,
      "uses_witness_invention": false
    },
    {
      "created_at": "2026-07-23T14:17:13Z",
      "environment_hash": "9e26d28efe88484c36562da27aa22a2cc73a0638d11532cbbc9071a60609025d",
      "export_eligibility": "restricted",
      "obligation_deps": [],
      "packet_id": "logic.functions.injective_comp_self.v1",
      "proof_variant_id": "pv.f81ecb7c-4902-4c02-bf40-58a90987a479.canonical",
      "record_hash": "3c5316e9e14d3aa414e0383e5d339d7dc48768d73c52acdb797fe6203fc20b28",
      "record_id": "dm.f81ecb7c-4902-4c02-bf40-58a90987a479",
      "record_type": "dependency_manifest",
      "schema_version": "1.0.0",
      "tactic_tags": [],
      "transitive_dependency_count": 0,
      "transitive_dependency_depth": 0,
      "trust_status": "kernel_verified",
      "used_theorem_deps": []
    },
    {
      "created_at": "2026-07-23T14:17:13Z",
      "diagnostic_category": null,
      "environment_hash": "9e26d28efe88484c36562da27aa22a2cc73a0638d11532cbbc9071a60609025d",
      "episode_id": "ae8905de-97b6-4101-b077-7afab61112a6",
      "export_eligibility": "restricted",
      "outcome": "succeeded",
      "packet_id": "logic.functions.injective_comp_self.v1",
      "record_hash": "f26a52fa1fd0bcd1b77afb74ca24331b9d079237a4bf8d4e04c8d18a2977629d",
      "record_id": "ar.c99a1d86-1073-4c55-a468-1903b3de3730",
      "record_type": "attempt_record",
      "schema_version": "1.0.0",
      "trust_status": "kernel_verified"
    },
    {
      "attempt_id": "ar.c99a1d86-1073-4c55-a468-1903b3de3730",
      "can_export_diagnostics": true,
      "can_export_metadata": true,
      "can_export_model_identity": false,
      "can_export_proof_text": false,
      "candidate_source_ref": null,
      "created_at": "2026-07-23T14:17:13Z",
      "diagnostic_category": "unknown_identifier",
      "environment_hash": "9e26d28efe88484c36562da27aa22a2cc73a0638d11532cbbc9071a60609025d",
      "export_eligibility": "restricted",
      "origin": "controlled_mutation",
      "packet_id": "logic.functions.injective_comp_self.v1",
      "proof_authority": "none",
      "record_hash": "2e14b2e224b9f999dbace39b50e51685a501d86bb5b30b60469b92ee97135693",
      "record_id": "neg.f81ecb7c-4902-4c02-bf40-58a90987a479.0",
      "record_type": "negative_example",
      "schema_version": "1.0.0",
      "trust_status": "kernel_verified"
    },
    {
      "attempt_id": "ar.c99a1d86-1073-4c55-a468-1903b3de3730",
      "can_export_diagnostics": true,
      "can_export_metadata": true,
      "can_export_model_identity": false,
      "can_export_proof_text": false,
      "candidate_source_ref": null,
      "created_at": "2026-07-23T14:17:13Z",
      "diagnostic_category": "unsolved_goals",
      "environment_hash": "9e26d28efe88484c36562da27aa22a2cc73a0638d11532cbbc9071a60609025d",
      "export_eligibility": "restricted",
      "origin": "controlled_mutation",
      "packet_id": "logic.functions.injective_comp_self.v1",
      "proof_authority": "none",
      "record_hash": "53e72ca271f7565344cfacd283681b2d2a0c4bdff9326e8bbaa57b8f8cd51140",
      "record_id": "neg.f81ecb7c-4902-4c02-bf40-58a90987a479.1",
      "record_type": "negative_example",
      "schema_version": "1.0.0",
      "trust_status": "kernel_verified"
    },
    {
      "action": {
        "proof_format": "flat_tactic_sequence",
        "proof_term": "intro α f hf; exact hf.comp hf",
        "type": "solve"
      },
      "action_space_version": null,
      "cost": null,
      "created_at": "2026-07-23T14:17:13Z",
      "environment_hash": "9e26d28efe88484c36562da27aa22a2cc73a0638d11532cbbc9071a60609025d",
      "episode_id": "ae8905de-97b6-4101-b077-7afab61112a6",
      "export_eligibility": "restricted",
      "formal_statement_sha256": "df6af0321aafea4c6982aef0688cc7c405af9493a3d79188509124fcd46f2fd1",
      "lean_cpu_time_ms": null,
      "model_config_hash": null,
      "next_state": {
        "artifact_hash": null,
        "inline": {
          "observation": {
            "state_hash": "28cca6776e79dd4d148e150e6a83e313df0581849ba1e5f87d1c2ad93cc33695",
            "unavailable": true
          },
          "state_hash": "28cca6776e79dd4d148e150e6a83e313df0581849ba1e5f87d1c2ad93cc33695"
        }
      },
      "observation_space_version": null,
      "outcome": "kernel_verified",
      "packet_id": "logic.functions.injective_comp_self.v1",
      "problem_version_id": "40143d2d-37dd-4ad9-a340-d8e6e5a774d7",
      "record_hash": "3c143c12f005e425979cb52d0f266f6a9eb4e6eb65e476a83728a261ca00c775",
      "record_id": "tr.ae8905de-97b6-4101-b077-7afab61112a6.0",
      "record_type": "rl_transition",
      "restriction_profile_hash": null,
      "restriction_profile_id": null,
      "reward": 2.49,
      "reward_policy_version": "1.0",
      "schema_version": "1.0.0",
      "state": {
        "artifact_hash": null,
        "inline": {
          "observation": {
            "budget": {
              "bytes_per_token": 4,
              "included_bytes": 389,
              "max_observation_bytes": 16000,
              "omitted_bytes": 0,
              "referenced_bytes": 0,
              "truncated": false
            },
            "direct_dependencies": [],
            "direct_dependency_signatures": [],
            "distilled_lesson": null,
            "env_id": "9e26d28efe88484c36562da27aa22a2cc73a0638d11532cbbc9071a60609025d",
            "import_manifest_hash": "aaf21893d520a78dee0787a1bcaf939ee6b922265ff670c272e2e1d450dd29a7",
            "latest_diagnostic": null,
            "obligation_signature": "theorem root_theorem : ∀ {α : Type*} (f : α → α), Function.Injective f → Function.Injective (f ∘ f)",
            "obligation_statement_hash": "c4004435957e5f844872df5bc5c17d8b4e2ac3c57cdfb2408ef3d0167745ff2c",
            "references": [],
            "retrieved_hint": null,
            "root_theorem_signature": "∀ {α : Type*} (f : α → α), Function.Injective f → Function.Injective (f ∘ f)"
          },
          "state_hash": "2b72b16b548356cceb289c9fd1d332f4ad07ac98e59caa1f9366dccf04a55027"
        }
      },
      "step_index": 0,
      "terminated": true,
      "termination_reason": null,
      "tokens": null,
      "truncated": false,
      "truncation_reason": null,
      "trust_status": "kernel_verified",
      "verifier_version": null,
      "wall_time_ms": null
    }
  ]
}